{
  "name": "Deutschrap Klassiker",
  "version": "1.4",
  "tags": [
    "deutschrap",
    "hip-hop",
    "rap",
    "german",
    "90s",
    "2000s",
    "2010s",
    "2020s"
  ],
  "language": "de",
  "author": "Beatify Team",
  "added_date": "2026-09-02",
  "description": "German-language rap from Fettes Brot, Die Fantastischen Vier and Beginner through Sido and Haftbefehl to Pashanim and Ski Aggu — three decades of Deutschrap in one round. Extended in September 2026 with 36 tracks from Spotify's Deutschrap: Die Klassiker (#2816); 62 tracks, 1995–2024.",
  "songs": [
    {
      "year": 1995,
      "uri": "spotify:track:0CbiLoqWTQG4TiyCizsxXd",
      "artist": "Schwester S.",
      "alt_artists": [
        "Cora E.",
        "Sabrina Setlur",
        "Lady Bitch Ray",
        "Nina MC"
      ],
      "title": "Ja klar",
      "fun_fact": "Schwester S. was the early stage name of Sabrina Setlur, who later charted under her own first name — the same artist behind two names.",
      "fun_fact_de": "Schwester S. war der fruehe Kuenstlername von Sabrina Setlur, die spaeter unter ihrem Vornamen in die Charts kam — dieselbe Kuenstlerin hinter zwei Namen.",
      "fun_fact_es": "Schwester S. fue el primer nombre artistico de Sabrina Setlur, que mas tarde entro en las listas con su propio nombre: la misma artista tras dos nombres.",
      "fun_fact_fr": "Schwester S. etait le premier nom de scene de Sabrina Setlur, entree ensuite dans les charts sous son prenom : la meme artiste sous deux noms.",
      "fun_fact_nl": "Schwester S. was de vroege artiestennaam van Sabrina Setlur, die later onder haar eigen voornaam in de hitlijsten kwam — dezelfde artieste met twee namen.",
      "uri_deezer": "deezer://track/124641868",
      "uri_apple_music": "applemusic://track/1119306834",
      "uri_youtube_music": "https://music.youtube.com/watch?v=3I7JOglOqtM"
    },
    {
      "year": 1997,
      "uri": "spotify:track:6EWtkdeKmVtRjmydTfIR0S",
      "artist": "Freundeskreis",
      "alt_artists": [
        "Die Fantastischen Vier",
        "Absolute Beginner",
        "Fettes Brot",
        "Blumentopf"
      ],
      "title": "A-N-N-A",
      "fun_fact": "The title is a palindrome and the hook plays on it: the chorus spells the name out because it reads the same in both directions.",
      "fun_fact_de": "Der Titel ist ein Palindrom, und der Refrain spielt genau damit — der Name wird buchstabiert, weil er vorwaerts wie rueckwaerts gleich gelesen wird.",
      "fun_fact_es": "El titulo es un palindromo y el estribillo juega con ello: deletrea el nombre porque se lee igual en ambos sentidos.",
      "fun_fact_fr": "Le titre est un palindrome et le refrain joue dessus : le prenom est epele parce qu'il se lit pareil dans les deux sens.",
      "fun_fact_nl": "De titel is een palindroom en het refrein speelt daarmee: de naam wordt gespeld omdat hij in beide richtingen hetzelfde leest.",
      "uri_apple_music": "applemusic://track/298144521",
      "uri_deezer": "deezer://track/15644778",
      "uri_youtube_music": "https://music.youtube.com/watch?v=qtVa-BwoZsU"
    },
    {
      "year": 1998,
      "uri": "spotify:track:6YzYyeMV5MY7wHOGskZdzf",
      "artist": "Beginner",
      "alt_artists": [
        "Fettes Brot",
        "Dynamite Deluxe",
        "Deichkind",
        "Fischmob"
      ],
      "title": "Liebes Lied",
      "fun_fact": "It comes from Bambule, the Hamburg album that made German-language rap a chart format rather than a scene affair.",
      "fun_fact_de": "Der Song stammt von Bambule, dem Hamburger Album, das deutschsprachigen Rap von einer Szene-Sache zu einem Chart-Format machte.",
      "fun_fact_es": "Procede de Bambule, el album de Hamburgo que convirtio el rap en aleman en un formato de listas y no solo en cosa de escena.",
      "fun_fact_fr": "Le morceau vient de Bambule, l'album hambourgeois qui a fait du rap en allemand un format de charts et plus seulement une affaire de scene.",
      "fun_fact_nl": "Het komt van Bambule, het Hamburgse album dat Duitstalige rap van scene-zaak tot hitlijstformaat maakte.",
      "uri_apple_music": "applemusic://track/1440731825",
      "uri_deezer": "deezer://track/2176668",
      "uri_youtube_music": "https://music.youtube.com/watch?v=k8gNzJcpHW0"
    },
    {
      "year": 2001,
      "uri": "spotify:track:47VRtROAdociHgtuVZNoBL",
      "artist": "Samy Deluxe",
      "alt_artists": [
        "Afrob",
        "Curse",
        "Torch",
        "D-Flame"
      ],
      "title": "Weck mich auf",
      "chart_info": {
        "german_peak": 4,
        "weeks_on_chart": 14
      },
      "certifications": [
        "Gold (DE)"
      ],
      "fun_fact": "Released as an EP in September 2001, it reached number four in the German singles chart and remains his best-known political song.",
      "fun_fact_de": "Im September 2001 als EP erschienen, erreichte der Song Platz vier der deutschen Singlecharts und ist bis heute sein bekanntester politischer Titel.",
      "fun_fact_es": "Publicado como EP en septiembre de 2001, alcanzo el numero cuatro en las listas alemanas y sigue siendo su cancion politica mas conocida.",
      "fun_fact_fr": "Sorti en EP en septembre 2001, il a atteint la quatrieme place des charts allemands et reste sa chanson politique la plus connue.",
      "fun_fact_nl": "In september 2001 als ep verschenen, haalde het nummer vier in de Duitse hitlijst en blijft zijn bekendste politieke song.",
      "uri_deezer": "deezer://track/3283333",
      "uri_youtube_music": "https://music.youtube.com/watch?v=I-GUVYbSxgI"
    },
    {
      "year": 2007,
      "uri": "spotify:track:1mC06CRaWGhsWhdX99GJqL",
      "artist": "AZAD",
      "alt_artists": [
        "Kool Savas",
        "Curse",
        "Chakuza",
        "Massiv"
      ],
      "title": "Prison Break Anthem (Ich glaub an Dich)",
      "fun_fact": "Built on the theme of the television series Prison Break, with Adel Tawil singing the hook years before Ich + Ich became a household name.",
      "fun_fact_de": "Gebaut auf dem Titelthema der Serie Prison Break, mit Adel Tawil auf dem Refrain — Jahre bevor Ich + Ich jeder kannte.",
      "fun_fact_es": "Construida sobre el tema de la serie Prison Break, con Adel Tawil en el estribillo anos antes de que Ich + Ich fuera conocido por todos.",
      "fun_fact_fr": "Construit sur le theme de la serie Prison Break, avec Adel Tawil au refrain, des annees avant qu'Ich + Ich ne soit connu de tous.",
      "fun_fact_nl": "Gebouwd op het thema van de serie Prison Break, met Adel Tawil op het refrein, jaren voordat Ich + Ich een begrip werd.",
      "uri_deezer": "deezer://track/1163878",
      "uri_apple_music": "applemusic://track/1444292071",
      "uri_youtube_music": "https://music.youtube.com/watch?v=-vSbQ7d4x1o"
    },
    {
      "year": 2008,
      "uri": "spotify:track:3tv1DRqL9KRuIUawu6eYG0",
      "artist": "Bushido",
      "alt_artists": [
        "Sido",
        "Fler",
        "Kool Savas",
        "Massiv"
      ],
      "title": "Für immer jung",
      "fun_fact": "A rap version of Alphaville's Forever Young, sung by Karel Gott — a pairing of German rap and Schlager that nobody had tried before.",
      "fun_fact_de": "Eine Rap-Fassung von Alphavilles Forever Young, gesungen von Karel Gott — eine Paarung aus Deutschrap und Schlager, die vorher niemand versucht hatte.",
      "fun_fact_es": "Una version rap de Forever Young de Alphaville, cantada por Karel Gott: una union de rap aleman y Schlager que nadie habia intentado antes.",
      "fun_fact_fr": "Une version rap de Forever Young d'Alphaville, chantee par Karel Gott : un melange de rap allemand et de Schlager que personne n'avait tente avant.",
      "fun_fact_nl": "Een rapversie van Forever Young van Alphaville, gezongen door Karel Gott — een combinatie van Duitse rap en Schlager die niemand eerder probeerde.",
      "uri_apple_music": "applemusic://track/1555448874",
      "uri_deezer": "deezer://track/1256158602",
      "uri_youtube_music": "https://music.youtube.com/watch?v=kxRRRkXNRcY"
    },
    {
      "year": 2009,
      "uri": "spotify:track:3RM5RpRDDdST1njqOMG141",
      "artist": "Culcha Candela",
      "alt_artists": [
        "Seeed",
        "Peter Fox",
        "Jan Delay",
        "Fettes Brot"
      ],
      "title": "Monsta",
      "chart_info": {
        "german_peak": 3,
        "weeks_on_chart": 63
      },
      "fun_fact": "The Berlin group sings in German, English, Spanish and Jamaican Patois — Monsta is the track that carried that mix into the summer charts.",
      "fun_fact_de": "Die Berliner Gruppe singt auf Deutsch, Englisch, Spanisch und jamaikanischem Patois — Monsta ist der Titel, der diese Mischung in die Sommercharts trug.",
      "fun_fact_es": "El grupo berlines canta en aleman, ingles, espanol y patois jamaicano; Monsta es el tema que llevo esa mezcla a las listas de verano.",
      "fun_fact_fr": "Le groupe berlinois chante en allemand, anglais, espagnol et patois jamaicain : Monsta est le titre qui a porte ce melange dans les charts d'ete.",
      "fun_fact_nl": "De Berlijnse groep zingt in het Duits, Engels, Spaans en Jamaicaans Patois — Monsta bracht die mix naar de zomerhitlijsten.",
      "uri_apple_music": "applemusic://track/1593834204",
      "uri_deezer": "deezer://track/1543798462",
      "uri_youtube_music": "https://music.youtube.com/watch?v=VNWO5N8Vxsc"
    },
    {
      "year": 2010,
      "uri": "spotify:track:02ywbmwM0tICk8EOhYIwpw",
      "artist": "Marteria",
      "alt_artists": [
        "Casper",
        "Prinz Pi",
        "Cro",
        "Kraftklub"
      ],
      "title": "Endboss",
      "fun_fact": "From Zum Glueck in die Zukunft, the album on which the Rostock rapper dropped his earlier English-language alias Marsimoto's twin persona for good.",
      "fun_fact_de": "Vom Album Zum Glueck in die Zukunft, mit dem der Rostocker Rapper seine fruehere englischsprachige Laufbahn endgueltig hinter sich liess.",